{
  "schema_version": 1,
  "id": "E4-midpoint-nudge-014",
  "title": "Midpoint nudge: one harness message at half the response budget when no source file is edited",
  "status": "approved",
  "markdown": "experiments/session_harness/E4-midpoint-nudge-014.md",
  "hypothesis": "On card 007's evolution set, where 3 of 8 rejections ran out of responses without an edit, one fixed harness message after half the budget without a source edit makes the model commit to a cause and edit, so fewer runs end at the budget without an edit; runs that edit earlier never see it, so the solved-twice tasks are unaffected.",
  "run_prefix": "c014",
  "run_name_template": "{prefix}-{task}-r{rollout}-{arm}",
  "runner": {
    "script": "experiments/p6_pilot/run_pilot.py",
    "runner_version": 8
  },
  "environment": {
    "claude_cli_version": "2.1.286 (Claude Code)"
  },
  "prerequisites": [
    {
      "text": "midpoint nudge implemented and unit-tested on wt/treatments (tests/test_midpoint_nudge.py)",
      "done": true
    },
    {
      "text": "owner approval recorded in the markdown card (then set status to running) (owner, in session 2026-09-28: 'you can continue... implementing those'; sequence approved)",
      "done": true
    }
  ],
  "arms": [
    {
      "name": "incumbent",
      "client": "claude-cli",
      "model": "claude-sonnet-5",
      "policy": "pressure-recent-v3",
      "toolset": "reticle-tools-v3",
      "backend": {
        "kind": "oci",
        "image": "localhost/reticle-p6-task:py313-v1",
        "image_id": "8b74015e5079d613ccd9f17d891fc540cf5b9d6a427b2512b92e6f50eafe355b",
        "engine": "podman"
      },
      "guards": {
        "stop_on_repeats": false,
        "resume_after_provider_stop": 0,
        "resume_wait_seconds": null
      },
      "extra_args": [],
      "expected_protocol_hash": null,
      "note": "Card 007's incumbent arm (runner v8, claude-cli adapter v2, repeat guard off) with the model pinned by full ID: claude-sonnet-5 (2026-09-30), not the alias 'sonnet', which CLI 2.1.286 resolved to claude-sonnet-5-5. The model ID is a hash input, so its planned hash per task differs from card 007's (which ran on the alias) and equals card 007's routing with only the model changed."
    },
    {
      "name": "midpoint-nudge",
      "client": "claude-cli",
      "model": "claude-sonnet-5",
      "policy": "pressure-recent-v3",
      "toolset": "reticle-tools-v3",
      "backend": {
        "kind": "oci",
        "image": "localhost/reticle-p6-task:py313-v1",
        "image_id": "8b74015e5079d613ccd9f17d891fc540cf5b9d6a427b2512b92e6f50eafe355b",
        "engine": "podman"
      },
      "guards": {
        "stop_on_repeats": false,
        "resume_after_provider_stop": 0,
        "resume_wait_seconds": null
      },
      "extra_args": [
        "--nudge",
        "midpoint"
      ],
      "expected_protocol_hash": null,
      "note": "Card 007's incumbent arm, model pinned to claude-sonnet-5, plus --nudge midpoint. The flag is a runner treatment (not a toolset or policy version); run_card.py hashes it from extra_args with the runner's own treatments_from_args, so the planned hash is the one the runner records.",
      "bundle": {
        "module": "agent loop",
        "surface": "continuation rule (harness message)",
        "treatment": "midpoint-nudge-v1",
        "flag": "--nudge midpoint",
        "fraction": 0.5,
        "code": "reticle/runtime/nudges.py",
        "source_rule": "pre-existing-python-source-v1"
      }
    }
  ],
  "controls": [
    {
      "name": "gold",
      "client": "gold",
      "task_set": "controls",
      "like_arm": "midpoint-nudge",
      "expect": "accepted"
    },
    {
      "name": "noop",
      "client": "noop",
      "task_set": "controls",
      "like_arm": "midpoint-nudge",
      "expect": "rejected"
    }
  ],
  "tasks": {
    "file": "experiments/mutation_tasks/tasks.mutations.json",
    "file_sha256": "fa185723735d56e7ff6858b7188bd603ed8f2ee0170637273fcaa71038db1daa",
    "sets": {
      "evolution": {
        "ids": [
          "sqlparse-mut-001",
          "sqlparse-mut-022",
          "sqlparse-mut-032",
          "sqlparse-mut-057",
          "sqlparse-mut-061"
        ],
        "note": "Card 007's evolution set: the two contrastive tasks (001, 022) and the three negative tasks with a fixable mechanism (032, 057, 061)."
      },
      "efficiency": {
        "ids": [
          "sqlparse-mut-025",
          "sqlparse-mut-034",
          "sqlparse-mut-040"
        ],
        "note": "Solved twice in card 007, for the efficiency measure (responses and active seconds per run). As listed by the owner; by card 007 wall time the three fastest are 034, 025 and 044 (040 is fifth)."
      },
      "controls": {
        "ids": [
          "sqlparse-mut-001"
        ],
        "note": "Scripted gold/noop controls under the treatment arm, before any model run."
      }
    }
  },
  "blocks": [
    {
      "name": "evolution",
      "task_set": "evolution",
      "arms": [
        "incumbent",
        "midpoint-nudge"
      ],
      "rollouts": 2,
      "arm_order": {
        "rule": "seeded",
        "seed": 14
      }
    },
    {
      "name": "efficiency",
      "task_set": "efficiency",
      "arms": [
        "incumbent",
        "midpoint-nudge"
      ],
      "rollouts": 2,
      "arm_order": {
        "rule": "seeded",
        "seed": 14
      }
    }
  ],
  "schedule": "rollout-major",
  "budgets": {
    "per_run": {
      "responses": 20,
      "model_attempts": 24,
      "active_seconds": 1200,
      "context_bytes": 80000,
      "max_tokens": 4096,
      "pytest_timeout_seconds": 600,
      "command_timeout_seconds": {
        "default": 120,
        "max": 600
      },
      "invocation_wall_seconds": 3600
    },
    "campaign": {
      "max_runs": 32,
      "max_model_attempts": 900,
      "monetary_cap_usd": null,
      "note": "32 runs x 24 attempts = 768 planned, plus room for 5 retried runs. CLI on the subscription: no monetary cap, billing recorded as unknown."
    }
  },
  "stop_rules": {
    "max_retries_per_invocation": 2,
    "retry_backoff_seconds": [
      60,
      300
    ],
    "consecutive_failures_to_stop": 3,
    "repeat_rule": "The markdown asks for the repeat flag to be recorded while the run continues. run_pilot.py records the flag only with --stop-on-repeats, which also stops the run, so this card runs without the guard and repeat_flags are derived from the transcripts afterwards (S6b).",
    "manual": [
      "Evaluator leakage, evidence loss, or authority escape stops the campaign (run_card.py detects evidence loss and protocol drift; leakage and escape need trajectory review).",
      "A symlink created by a run command is unreadable on the Windows host and ends the campaign as evidence loss; resume reruns the interrupted task.",
      "Do not change the treatment's text or parameters during the card; a change is a new version and a new card.",
      "Stop if a treatment run carries more than one harness_message event (the nudge fires at most once by construction)."
    ]
  },
  "measurements": {
    "per_run": [
      "accepted",
      "stop_reason",
      "responses_used",
      "provider_attempts",
      "tool_calls",
      "active_seconds",
      "wall_seconds",
      "tokens",
      "first_edit_response",
      "rejected_calls",
      "edit_in_gold_files",
      "verification_before_finish"
    ],
    "campaign": [
      "acceptance_rate_ci",
      "per_task_outcomes",
      "outcome_distribution",
      "paired_table",
      "delta:incumbent:midpoint-nudge"
    ]
  },
  "decision_rule": "Mechanism check, not a promotion (held-in tasks, 16 paired units per arm). Report per arm and set: runs where the nudge fired, the response of the first edit after it and whether it touched the gold file, runs ending at the budget without an edit, and acceptance. Earn a held-out card only if no accepted run is lost on the efficiency set and fewer evolution-set runs end at the budget without an edit than under the incumbent; otherwise reject and log.",
  "report": {
    "path": "experiments/session_harness/E4-midpoint-nudge-014-report.md"
  },
  "notes": [
    "Runs are named c014-<task>-r<n>-<arm>; one runner invocation per task, rollout and arm, with --max-total-calls 24.",
    "Arm order is seeded per unit (block, task, rollout), so a task's two rollouts can run the arms in different orders; every unit runs both arms.",
    "The incumbent arm is card 007's with the model pinned to claude-sonnet-5. Before the pin (alias 'sonnet') its planned hash per task equaled card 007's (for example b0fda8c921ad for sqlparse-mut-001 on a CRLF checkout); the full model ID is a hash input, so it no longer does.",
    "Model pinned by full ID (claude-sonnet-5, 2026-09-30) after alias drift: CLI 2.1.286 resolved the alias 'sonnet' to claude-sonnet-5-5, while c007/c013/c018 ran on claude-sonnet-5.",
    "The treatment enters the protocol hash only through the runner's 'treatments' record; RUNNER_VERSION stays 8."
  ]
}