{
  "schema_version": 1,
  "id": "E4-diagnostic-commitment-009",
  "title": "One manual round of the harness self-improvement loop (S6c)",
  "status": "proposed",
  "markdown": "experiments/session_harness/E4-diagnostic-commitment-009.md",
  "hypothesis": "A three-sentence addition to the opening instructions (state the suspected cause, edit by the budget midpoint, run the narrowest check before finish) raises acceptance on held-in and held-out tasks without changing any other surface.",
  "run_prefix": "c009",
  "runner": {"script": "experiments/p6_pilot/run_pilot.py", "runner_version": 8},
  "environment": {"claude_cli_version": "2.1.283 (Claude Code)"},
  "prerequisites": [
    {"text": "Card 007 complete, and E3-calibration-007.sets.json lists held_in (up to 8 tasks whose trajectories produced the evidence) and held_out (8 other evolution-set tasks never inspected while writing the candidate)", "done": false},
    {"text": "S6b signatures have chosen the target cluster", "done": false},
    {"text": "Candidate wording fixed in the markdown card before any run", "done": false},
    {"text": "S6a wiring for the mutation task file: run_pilot.py --tasks FILE.json IDS with materializer mutation-workspace-v2 (merged at eb3c160)", "done": true},
    {"text": "owner approval (then set status to approved)", "done": false}
  ],
  "arms": [
    {
      "name": "incumbent",
      "client": "claude-cli",
      "model": "sonnet",
      "policy": "pressure-recent-v3",
      "toolset": "reticle-tools-v3",
      "backend": {
        "kind": "oci",
        "image": "localhost/reticle-p6-task:py313-v1",
        "image_id": "8b74015e5079d613ccd9f17d891fc540cf5b9d6a427b2512b92e6f50eafe355b",
        "engine": "podman"
      },
      "guards": {"stop_on_repeats": false, "resume_after_provider_stop": 0, "resume_wait_seconds": null},
      "extra_args": [],
      "expected_protocol_hash": null
    },
    {
      "name": "candidate",
      "client": "claude-cli",
      "model": "sonnet",
      "policy": "pressure-recent-v3",
      "toolset": "reticle-tools-v3",
      "backend": {
        "kind": "oci",
        "image": "localhost/reticle-p6-task:py313-v1",
        "image_id": "8b74015e5079d613ccd9f17d891fc540cf5b9d6a427b2512b92e6f50eafe355b",
        "engine": "podman"
      },
      "guards": {"stop_on_repeats": false, "resume_after_provider_stop": 0, "resume_wait_seconds": null},
      "extra_args": [],
      "runner": {"unresolved": "run_pilot.py has no flag for the opening instructions; S6c must add a bundle declaration (a runner flag whose value enters the protocol hash) or point this arm at a candidate worktree's run_pilot.py that differs only in INSTRUCTIONS"},
      "bundle": {
        "module": "agent-loop",
        "surface": "opening instructions",
        "text": {"unresolved": "exact wording, at most three sentences, fixed in the markdown card before any run"}
      },
      "expected_protocol_hash": null,
      "note": "Nothing else in the bundle changes; its protocol hash must differ from the incumbent's only through the instructions."
    },
    {
      "name": "no-change",
      "client": "claude-cli",
      "model": "sonnet",
      "policy": "pressure-recent-v3",
      "toolset": "reticle-tools-v3",
      "backend": {
        "kind": "oci",
        "image": "localhost/reticle-p6-task:py313-v1",
        "image_id": "8b74015e5079d613ccd9f17d891fc540cf5b9d6a427b2512b92e6f50eafe355b",
        "engine": "podman"
      },
      "guards": {"stop_on_repeats": false, "resume_after_provider_stop": 0, "resume_wait_seconds": null},
      "extra_args": [],
      "expected_protocol_hash": null,
      "note": "The incumbent run twice more on 4 tasks to estimate evaluation noise; identical protocol to incumbent."
    }
  ],
  "tasks": {
    "file": "experiments/mutation_tasks/tasks.mutations.json",
    "file_sha256": "fa185723735d56e7ff6858b7188bd603ed8f2ee0170637273fcaa71038db1daa",
    "sets": {
      "held_in": {"ref": {"path": "experiments/session_harness/E3-calibration-007.sets.json", "key": "held_in", "sha256": null}},
      "held_out": {"ref": {"path": "experiments/session_harness/E3-calibration-007.sets.json", "key": "held_out", "sha256": null}},
      "paired": {"from_sets": ["held_in", "held_out"]},
      "noise": {
        "from_sets": ["held_in", "held_out"],
        "take": {"count": 4, "seed": 9009},
        "note": "The markdown does not say which 4 tasks; this card draws them by seed from the 16 paired tasks."
      }
    }
  },
  "blocks": [
    {"name": "paired", "task_set": "paired", "arms": ["incumbent", "candidate"], "rollouts": 2, "arm_order": {"rule": "seeded", "seed": 9009}},
    {"name": "noise", "task_set": "noise", "arms": ["no-change"], "rollouts": 2, "arm_order": {"rule": "fixed"}}
  ],
  "schedule": "rollout-major",
  "budgets": {
    "per_run": {
      "responses": 20,
      "model_attempts": 24,
      "active_seconds": 1200,
      "context_bytes": 80000,
      "max_tokens": 4096,
      "pytest_timeout_seconds": 600,
      "command_timeout_seconds": {"default": 120, "max": 600},
      "invocation_wall_seconds": 3600
    },
    "campaign": {
      "max_runs": 72,
      "max_model_attempts": 2000,
      "monetary_cap_usd": null,
      "note": "64 paired runs + 8 no-change runs = 72 x 24 attempts = 1,728 planned, plus room for 11 retried runs. About two hours of wall time at 90 s per run; no monetary cost."
    }
  },
  "stop_rules": {
    "max_retries_per_invocation": 2,
    "retry_backoff_seconds": [60, 300],
    "consecutive_failures_to_stop": 3,
    "repeat_rule": "No repeat stop in any arm (identical predeclared rule across arms, plan 5.3 for E4).",
    "manual": [
      "Stop if the candidate changes any surface other than the opening instructions (bundle hash check).",
      "Stop if the held-out list is read by anyone writing the candidate."
    ]
  },
  "measurements": {
    "per_run": ["accepted", "stop_reason", "responses_used", "wall_seconds", "first_edit_response", "verification_before_finish"],
    "campaign": ["paired_table", "delta:candidate:incumbent", "delta:no-change:incumbent", "acceptance_rate_ci"]
  },
  "decision_rule": "Promote only if delta_in >= 0 and delta_oh >= 0 and max(delta_in, delta_oh) exceeds the no-change arm's observed spread. Otherwise reject and log. A rejected candidate with delta_oh < 0 is also evidence for S6's diff-review gate: record what the edit encoded.",
  "report": {"path": "experiments/session_harness/E4-diagnostic-commitment-009-report.md", "sets_path": null},
  "notes": [
    "delta:candidate:incumbent is reported per task set, so the held_in row is delta_in and the held_out row is delta_oh; delta:no-change:incumbent on the noise set is the spread.",
    "Plan now: blocked on the task-set file, the candidate runner, and the candidate wording, each named by --plan."
  ]
}
